2218,6/5/2021,"Đường Lò Đúc, Phường Đống Mác, Quận Hai Bà Trưng, Hà Nội",Quận Hai Bà Trưng,Phường Đống Mác,"Nhà ngõ, hẻm",Đã có sổ,5,3 phòng,35 m²,35 m,4.5 m,100 triệu/m²
2219,6/5/2021,"Đường Tô Hiệu, Phường Nguyễn Trãi, Quận Hà Đông, Hà Nội",Quận Hà Đông,Phường Nguyễn Trãi,"Nhà ngõ, hẻm",Đã có sổ,3,3 phòng,46 m²,11 m,4 m,"72,83 triệu/m²"
2220,6/5/2021,"Đường Hoàng Văn Thái, Phường Khương Mai, Quận Thanh Xuân, Hà Nội",Quận Thanh Xuân,Phường Khương Mai,"Nhà ngõ, hẻm",Đã có sổ,5,4 phòng,48 m²,10.25 m,4.75 m,"108,33 triệu/m²"
2221,6/5/2021,"Đường Nguyễn Khang, Phường Dịch Vọng, Quận Cầu Giấy, Hà Nội",Quận Cầu Giấy,Phường Dịch Vọng,"Nhà ngõ, hẻm",Đã có sổ,3,3 phòng,70 m²,14 m,5 m,"64,29 triệu/m²"
2222,6/5/2021,"Đường Đào Tấn, Phường Cống Vị, Quận Ba Đình, Hà Nội",Quận Ba Đình,Phường Cống Vị,"Nhà ngõ, hẻm",Đã có sổ,5,4 phòng,50 m²,9.2 m,5.4 m,114 triệu/m²
2223,6/5/2021,"15A, Ngõ 2, Đường Cầu Đơ 3, Phường Hà Cầu, Quận Hà Đông, Hà Nội",Quận Hà Đông,Phường Hà Cầu,"Nhà ngõ, hẻm",Đã có sổ,3,3 phòng,52 m²,9.5 m,5.6 m,"62,5 triệu/m²"
2224,6/5/2021,"Đường Trần Quốc Hoàn, Phường Dịch Vọng Hậu, Quận Cầu Giấy, Hà Nội",Quận Cầu Giấy,Phường Dịch Vọng Hậu,"Nhà ngõ, hẻm",Đã có sổ,5,5 phòng,45 m²,12 m,5 m,"262,22 triệu/m²"
2225,6/5/2021,"Đường Khuất Duy Tiến, Phường Thanh Xuân Bắc, Quận Thanh Xuân, Hà Nội",Quận Thanh Xuân,Phường Thanh Xuân Bắc,"Nhà mặt phố, mặt tiền",Đã có sổ,7,9 phòng,52 m²,10.5 m,5 m,"317,31 triệu/m²"
2226,6/5/2021,"Đường Lâm Du, Phường Bồ Đề, Quận Long Biên, Hà Nội",Quận Long Biên,Phường Bồ Đề,"Nhà ngõ, hẻm",Đã có sổ,4,4 phòng,33 m²,8 m,4 m,"87,88 triệu/m²"
2227,6/5/2021,"Đường Trần Khát Chân, Phường Thanh Nhàn, Quận Hai Bà Trưng, Hà Nội",Quận Hai Bà Trưng,Phường Thanh Nhàn,"Nhà ngõ, hẻm",Đã có sổ,5,3 phòng,33 m²,10.6 m,3.1 m,"109,09 triệu/m²"
2228,6/5/2021,"Đường Thái Hà, Phường Trung Liệt, Quận Đống Đa, Hà Nội",Quận Đống Đa,Phường Trung Liệt,"Nhà ngõ, hẻm",Đã có sổ,4,4 phòng,40 m²,10 m,4 m,175 triệu/m²
2229,6/5/2021,"Đường Định Công, Phường Định Công, Quận Hoàng Mai, Hà Nội",Quận Hoàng Mai,Phường Định Công,"Nhà mặt phố, mặt tiền",Đã có sổ,4,3 phòng,25 m²,6 m,4 m,182 triệu/m²
2230,6/5/2021,"ngõ 12 nghĩa dũng, Phường Phúc Xá, Quận Ba Đình, Hà Nội",Quận Ba Đình,Phường Phúc Xá,"Nhà ngõ, hẻm",Đã có sổ,4,3 phòng,37 m²,12.3 m,3 m,"2,3 triệu/m²"
2231,6/5/2021,"Đường Thái Thịnh, Phường Thịnh Quang, Quận Đống Đa, Hà Nội",Quận Đống Đa,Phường Thịnh Quang,"Nhà ngõ, hẻm",Đã có sổ,4,4 phòng,34 m²,10 m,3.3 m,"202,94 triệu/m²"
2232,6/5/2021,"Đường Minh Khai, Phường Minh Khai, Quận Hai Bà Trưng, Hà Nội",Quận Hai Bà Trưng,Phường Minh Khai,"Nhà ngõ, hẻm",Đã có sổ,4,3 phòng,31 m²,10 m,3.1 m,"61,29 triệu/m²"
2233,6/5/2021,"6789, Đường Trương Định, Phường Hoàng Văn Thụ, Quận Hoàng Mai, Hà Nội",Quận Hoàng Mai,Phường Hoàng Văn Thụ,"Nhà ngõ, hẻm",Đã có sổ,5,4 phòng,36 m²,7 m,5 m,"101,49 triệu/m²"
2234,6/5/2021,"Đường Đền Lừ, Phường Thịnh Liệt, Quận Hoàng Mai, Hà Nội",Quận Hoàng Mai,Phường Thịnh Liệt,Nhà phố liền kề,Đã có sổ,5,5 phòng,63 m²,16 m,4.5 m,"125,4 triệu/m²"
2235,6/5/2021,"Đường Nguyễn Chí Thanh, Phường Láng Hạ, Quận Đống Đa, Hà Nội",Quận Đống Đa,Phường Láng Hạ,"Nhà ngõ, hẻm",Đã có sổ,5,5 phòng,56 m²,10 m,5.6 m,"139,09 triệu/m²"
2236,6/5/2021,"Ngõ 81, Đường Lạc Long Quân, Phường Xuân La, Quận Tây Hồ, Hà Nội",Quận Tây Hồ,Phường Xuân La,"Nhà ngõ, hẻm",Đã có sổ,5,3 phòng,35 m²,10 m,35 m,"128,57 triệu/m²"
2237,6/5/2021,"0, Hồng Mai, Phường Bạch Mai, Quận Hai Bà Trưng, Hà Nội",Quận Hai Bà Trưng,Phường Bạch Mai,"Nhà ngõ, hẻm",Đã có sổ,5,3 phòng,27 m²,5 m,5 m,"96,3 triệu/m²"
2238,6/5/2021,"Đường Trường Chinh, Phường Trung Tự, Quận Đống Đa, Hà Nội",Quận Đống Đa,Phường Trung Tự,"Nhà ngõ, hẻm",Đã có sổ,3,3 phòng,20 m²,5 m,4 m,115 triệu/m²
2239,6/5/2021,"111, Đường Lê Trọng Tấn, Phường La Khê, Quận Hà Đông, Hà Nội",Quận Hà Đông,Phường La Khê,"Nhà ngõ, hẻm",Đã có sổ,5,4 phòng,40 m²,8 m,5 m,60 triệu/m²
2241,6/5/2021,"Đường Minh Khai, Phường Minh Khai, Quận Hai Bà Trưng, Hà Nội",Quận Hai Bà Trưng,Phường Minh Khai,"Nhà mặt phố, mặt tiền",Đã có sổ,6,4 phòng,42 m²,8 m,5 m,"147,62 triệu/m²"
2242,6/5/2021,"Định Công Thượng, Phường Định Công, Quận Hoàng Mai, Hà Nội",Quận Hoàng Mai,Phường Định Công,"Nhà ngõ, hẻm",Đã có sổ,6,7 phòng,55 m²,16.91 m,3.22 m,100 triệu/m²
2243,6/5/2021,"Đường Tô Hiệu, Phường Nguyễn Trãi, Quận Hà Đông, Hà Nội",Quận Hà Đông,Phường Nguyễn Trãi,"Nhà mặt phố, mặt tiền",Đã có sổ,3,3 phòng,46 m²,11 m,4 m,"72,83 triệu/m²"
2244,6/5/2021,"Đường Chợ Khâm Thiên, Phường Khâm Thiên, Quận Đống Đa, Hà Nội",Quận Đống Đa,Phường Khâm Thiên,"Nhà ngõ, hẻm",Đã có sổ,3,2 phòng,23 m²,7 m,3 m,"58,7 triệu/m²"
2245,6/5/2021,"Đường Hoàng Văn Thái, Phường Khương Trung, Quận Thanh Xuân, Hà Nội",Quận Thanh Xuân,Phường Khương Trung,"Nhà ngõ, hẻm",Đã có sổ,4,3 phòng,65 m²,10 m,7 m,"103,08 triệu/m²"
2246,6/5/2021,"Đường An Hòa, Phường Mộ Lao, Quận Hà Đông, Hà Nội",Quận Hà Đông,Phường Mộ Lao,"Nhà mặt phố, mặt tiền",Đã có sổ,4,2 phòng,26 m²,7 m,3.5 m,"111,54 triệu/m²"
2247,6/5/2021,"Đường Hoa Bằng, Phường Yên Hoà, Quận Cầu Giấy, Hà Nội",Quận Cầu Giấy,Phường Yên Hoà,"Nhà mặt phố, mặt tiền",Đã có sổ,5,4 phòng,52 m²,10 m,5 m,"179,81 triệu/m²"
2248,6/5/2021,"155 Cầu Giấy, Đường Cầu Giấy, Phường Dịch Vọng, Quận Cầu Giấy, Hà Nội",Quận Cầu Giấy,Phường Dịch Vọng,"Nhà ngõ, hẻm",Đã có sổ,6,6 phòng,33 m²,11 m,3 m,"98,48 triệu/m²"
2249,6/5/2021,"Đường Văn Cao, Phường Liễu Giai, Quận Ba Đình, Hà Nội",Quận Ba Đình,Phường Liễu Giai,"Nhà ngõ, hẻm",Đã có sổ,4,3 phòng,39 m²,9 m,4 m,"74,36 triệu/m²"
2250,6/5/2021,"Đường Hạ Đình, Phường Hạ Đình, Quận Thanh Xuân, Hà Nội",Quận Thanh Xuân,Phường Hạ Đình,"Nhà ngõ, hẻm",Đã có sổ,2,1 phòng,19 m²,6 m,3.4 m,"71,05 triệu/m²"
2253,6/5/2021,"Đường Tô Hiệu, Phường Quang Trung, Quận Hà Đông, Hà Nội",Quận Hà Đông,Phường Quang Trung,"Nhà mặt phố, mặt tiền",Đã có sổ,6,4 phòng,40 m²,11 m,3.5 m,"131,25 triệu/m²"
2254,6/5/2021,"Đường Tôn Đức Thắng||450, Phường Hàng Bột, Quận Đống Đa, Hà Nội",Quận Đống Đa,Phường Hàng Bột,"Nhà mặt phố, mặt tiền",Đã có sổ,5,4 phòng,46 m²,6 m,8 m,"178,26 triệu/m²"
2255,6/5/2021,"Đường Định Công, Phường Khương Mai, Quận Thanh Xuân, Hà Nội",Quận Thanh Xuân,Phường Khương Mai,"Nhà ngõ, hẻm",Đã có sổ,4,2 phòng,30 m²,6 m,5 m,"106,67 triệu/m²"
2256,6/5/2021,"đường thuỵ KHuê, Phường Bưởi, Quận Tây Hồ, Hà Nội",Quận Tây Hồ,Phường Bưởi,"Nhà mặt phố, mặt tiền",Đã có sổ,6,4 phòng,30 m²,8.5 m,3.6 m,"126,67 triệu/m²"
2257,6/5/2021,"402, Đường Âu Cơ, Phường Tứ Liên, Quận Tây Hồ, Hà Nội",Quận Tây Hồ,Phường Tứ Liên,"Nhà mặt phố, mặt tiền",Đã có sổ,4,4 phòng,40 m²,10 m,4 m,80 triệu/m²
2258,6/5/2021,"Đường Nguyễn Khuyến, Phường Văn Quán, Quận Hà Đông, Hà Nội",Quận Hà Đông,Phường Văn Quán,"Nhà ngõ, hẻm",Đã có sổ,5,3 phòng,33 m²,8.5 m,4 m,"69,7 triệu/m²"
2259,6/5/2021,"Đường Chùa Láng, Phường Láng Thượng, Quận Đống Đa, Hà Nội",Quận Đống Đa,Phường Láng Thượng,"Nhà ngõ, hẻm",Đã có sổ,6,4 phòng,45 m²,10 m,4.5 m,80 triệu/m²
2260,6/5/2021,"Đường Quang Tiến, Phường Đại Mỗ, Quận Nam Từ Liêm, Hà Nội",Quận Nam Từ Liêm,Phường Đại Mỗ,"Nhà mặt phố, mặt tiền",Đang chờ sổ,5,5 phòng,45 m²,12 m,3.8 m,100 triệu/m²
2261,6/5/2021,"Đường Hoàng Văn Thái, Phường Khương Trung, Quận Thanh Xuân, Hà Nội",Quận Thanh Xuân,Phường Khương Trung,"Nhà ngõ, hẻm",Đã có sổ,5,3 phòng,42 m²,11.5 m,4 m,"103,57 triệu/m²"
2262,6/5/2021,"Đường Võng Thị, Phường Xuân La, Quận Tây Hồ, Hà Nội",Quận Tây Hồ,Phường Xuân La,"Nhà ngõ, hẻm",Đã có sổ,5,7 phòng,50 m²,9.5 m,5.3 m,170 triệu/m²
2263,6/5/2021,"Đường Khương Thượng, Phường Khương Thượng, Quận Đống Đa, Hà Nội",Quận Đống Đa,Phường Khương Thượng,"Nhà ngõ, hẻm",Đã có sổ,5,3 phòng,10 m²,25 m,4 m,140 triệu/m²
2264,6/5/2021,"Đường Trần Cung, Phường Cổ Nhuế 1, Quận Bắc Từ Liêm, Hà Nội",Quận Bắc Từ Liêm,Phường Cổ Nhuế 1,"Nhà ngõ, hẻm",Đã có sổ,3,3 phòng,46 m²,11.6 m,4 m,"52,17 triệu/m²"
2265,6/5/2021,"197, Đường Hoàng Mai, Phường Tương Mai, Quận Hoàng Mai, Hà Nội",Quận Hoàng Mai,Phường Tương Mai,"Nhà ngõ, hẻm",Đã có sổ,4,5 phòng,38 m²,10 m,4 m,"81,58 triệu/m²"
2266,6/5/2021,"2, Đường Cầu Giấy, Phường Dịch Vọng, Quận Cầu Giấy, Hà Nội",Quận Cầu Giấy,Phường Dịch Vọng,"Nhà mặt phố, mặt tiền",Đã có sổ,4,3 phòng,50 m²,10 m,5 m,150 triệu/m²
2267,6/5/2021,"Đường Đào Tấn, Phường Đội Cấn, Quận Ba Đình, Hà Nội",Quận Ba Đình,Phường Đội Cấn,"Nhà mặt phố, mặt tiền",Đã có sổ,4,3 phòng,22 m²,8 m,3 m,"89,09 triệu/m²"
2268,6/5/2021,"Ngõ 6 - Hà Trì 1, Đường Bà Triệu, Phường Hà Cầu, Quận Hà Đông, Hà Nội",Quận Hà Đông,Phường Hà Cầu,"Nhà ngõ, hẻm",Đã có sổ,3,3 phòng,45 m²,5 m,9 m,"62,22 triệu/m²"
2269,6/5/2021,"Đường Trần Cung, Phường Cổ Nhuế 1, Quận Bắc Từ Liêm, Hà Nội",Quận Bắc Từ Liêm,Phường Cổ Nhuế 1,"Nhà ngõ, hẻm",Đã có sổ,3,3 phòng,43 m²,10 m,4.2 m,"55,81 triệu/m²"
2270,6/5/2021,"Đường Ngô Thì Sỹ, Phường Vạn Phúc, Quận Hà Đông, Hà Nội",Quận Hà Đông,Phường Vạn Phúc,"Nhà ngõ, hẻm",Đã có sổ,5,3 phòng,30 m²,10 m,3 m,"91,67 triệu/m²"
2271,6/5/2021,"Đường Khương Trung, Phường Khương Trung, Quận Thanh Xuân, Hà Nội",Quận Thanh Xuân,Phường Khương Trung,"Nhà ngõ, hẻm",Đã có sổ,3,3 phòng,35 m²,10 m,3.5 m,"68,57 triệu/m²"
2272,6/5/2021,"282, Đường Ngọc Thụy, Phường Ngọc Thụy, Quận Long Biên, Hà Nội",Quận Long Biên,Phường Ngọc Thụy,"Nhà ngõ, hẻm",Đã có sổ,4,4 phòng,42 m²,9.3 m,4.5 m,"80,95 triệu/m²"
2273,6/5/2021,"26, Đường Chợ Khâm Thiên, Phường Khâm Thiên, Quận Đống Đa, Hà Nội",Quận Đống Đa,Phường Khâm Thiên,"Nhà ngõ, hẻm",Đã có sổ,5,3 phòng,30 m²,6.4 m,4.1 m,"83,33 triệu/m²"
2274,6/5/2021,"đường Lê Trọng Tấn, Phường Kiến Hưng, Quận Hà Đông, Hà Nội",Quận Hà Đông,Phường Kiến Hưng,"Nhà mặt phố, mặt tiền",Đã có sổ,3,3 phòng,32 m²,11 m,3 m,"40,63 triệu/m²"
2275,6/5/2021,"Đường Láng, Phường Láng Hạ, Quận Đống Đa, Hà Nội",Quận Đống Đa,Phường Láng Hạ,"Nhà ngõ, hẻm",Đã có sổ,5,3 phòng,31 m²,6 m,5.2 m,"106,45 triệu/m²"
2276,6/5/2021,"Phố Chùa Bộc., Phường Trung Liệt, Quận Đống Đa, Hà Nội",Quận Đống Đa,Phường Trung Liệt,Nhà phố liền kề,Đã có sổ,4,3 phòng,32 m²,8 m,4 m,"162,5 triệu/m²"
2277,6/5/2021,"Đường Lê Quang Đạo, Phường Phú Đô, Quận Nam Từ Liêm, Hà Nội",Quận Nam Từ Liêm,Phường Phú Đô,"Nhà ngõ, hẻm",Đã có sổ,5,3 phòng,30 m²,10 m,3 m,"83,33 triệu/m²"
2278,6/5/2021,"Đường Khuất Duy Tiến, Phường Thanh Xuân Bắc, Quận Thanh Xuân, Hà Nội",Quận Thanh Xuân,Phường Thanh Xuân Bắc,"Nhà mặt phố, mặt tiền",Đã có sổ,4,4 phòng,57 m²,14 m,4 m,"121,05 triệu/m²"
2279,6/5/2021,"Đường Ngô Thì Nhậm, Phường Quang Trung, Quận Hà Đông, Hà Nội",Quận Hà Đông,Phường Quang Trung,Nhà phố liền kề,Đã có sổ,4,4 phòng,48 m²,12 m,4 m,"83,33 triệu/m²"
2280,6/5/2021,"Đường Nam Dư, Phường Lĩnh Nam, Quận Hoàng Mai, Hà Nội",Quận Hoàng Mai,Phường Lĩnh Nam,"Nhà mặt phố, mặt tiền",Đã có sổ,4,5 phòng,65 m²,4 m,4 m,"123,08 triệu/m²"
2281,6/5/2021,"Đường Lê Trọng Tấn, Phường La Khê, Quận Hà Đông, Hà Nội",Quận Hà Đông,Phường La Khê,"Nhà ngõ, hẻm",Đã có sổ,4,4 phòng,35 m²,7 m,5 m,"62,29 triệu/m²"
2282,6/5/2021,"Đường Giáp Nhất, Phường Thanh Xuân Trung, Quận Thanh Xuân, Hà Nội",Quận Thanh Xuân,Phường Thanh Xuân Trung,"Nhà ngõ, hẻm",Đã có sổ,5,4 phòng,50 m²,17 m,3.3 m,95 triệu/m²
2283,6/5/2021,"Đường Cầu Giấy, Phường Quan Hoa, Quận Cầu Giấy, Hà Nội",Quận Cầu Giấy,Phường Quan Hoa,"Nhà mặt phố, mặt tiền",Đã có sổ,6,3 phòng,45 m²,13 m,4.2 m,"195,56 triệu/m²"
2284,6/5/2021,"Đường Khương Thượng, Phường Khương Thượng, Quận Đống Đa, Hà Nội",Quận Đống Đa,Phường Khương Thượng,"Nhà ngõ, hẻm",Đã có sổ,5,3 phòng,15 m²,5 m,3 m,"66,67 triệu/m²"
2285,6/5/2021,"Đường Đường Láng, Phường Láng Thượng, Quận Đống Đa, Hà Nội",Quận Đống Đa,Phường Láng Thượng,"Nhà mặt phố, mặt tiền",Đã có sổ,5,4 phòng,77 m²,17 m,4 m,"57,79 triệu/m²"
2286,6/5/2021,"Đường 19/5, Phường Văn Quán, Quận Hà Đông, Hà Nội",Quận Hà Đông,Phường Văn Quán,"Nhà ngõ, hẻm",Đã có sổ,5,5 phòng,50 m²,16 m,3.5 m,53 triệu/m²
2287,6/5/2021,"Đường Ngõ Quỳnh, Phường Bạch Mai, Quận Hai Bà Trưng, Hà Nội",Quận Hai Bà Trưng,Phường Bạch Mai,"Nhà ngõ, hẻm",Đã có sổ,4,3 phòng,16 m²,4 m,3 m,"87,5 triệu/m²"
2288,6/5/2021,"Đường Đa Sĩ, Phường Kiến Hưng, Quận Hà Đông, Hà Nội",Quận Hà Đông,Phường Kiến Hưng,"Nhà ngõ, hẻm",Đã có sổ,4,4 phòng,50 m²,12.5 m,4 m,54 triệu/m²
2289,6/5/2021,"Đường Lý Nam Đế, Phường Cửa Đông, Quận Hoàn Kiếm, Hà Nội",Quận Hoàn Kiếm,Phường Cửa Đông,"Nhà ngõ, hẻm",Đã có sổ,3,3 phòng,55 m²,15 m,4 m,"203,64 triệu/m²"
2290,6/5/2021,"Số 27, Số 27 đường Cổ Linh, Phường Long Biên, Quận Long Biên, Hà Nội",Quận Long Biên,Phường Long Biên,"Nhà mặt phố, mặt tiền",Đã có sổ,4,5 phòng,40 m²,10 m,4 m,"58,75 triệu/m²"
2291,6/5/2021,"Số 27, Số 27 đường Cổ Linh, Phường Long Biên, Quận Long Biên, Hà Nội",Quận Long Biên,Phường Long Biên,"Nhà mặt phố, mặt tiền",Đã có sổ,4,7 phòng,100 m²,20 m,5 m,69 triệu/m²
2292,6/5/2021,"Đường Lĩnh Nam, Phường Lĩnh Nam, Quận Hoàng Mai, Hà Nội",Quận Hoàng Mai,Phường Lĩnh Nam,"Nhà ngõ, hẻm",Đã có sổ,4,4 phòng,40 m²,8 m,5 m,"61,25 triệu/m²"
2293,6/5/2021,"Đường Đốc Ngữ, Phường Vĩnh Phúc, Quận Ba Đình, Hà Nội",Quận Ba Đình,Phường Vĩnh Phúc,"Nhà ngõ, hẻm",Đã có sổ,4,4 phòng,45 m²,12 m,3.8 m,"88,89 triệu/m²"
2294,6/5/2021,"Bồ Đề, Phường Bồ Đề, Quận Long Biên, Hà Nội",Quận Long Biên,Phường Bồ Đề,"Nhà ngõ, hẻm",Đã có sổ,5,5 phòng,55 m²,7.8 m,7 m,"106,36 triệu/m²"
2295,6/5/2021,"Đường Đường Láng, Phường Láng Thượng, Quận Đống Đa, Hà Nội",Quận Đống Đa,Phường Láng Thượng,"Nhà ngõ, hẻm",Đã có sổ,5,3 phòng,35 m²,7 m,5 m,"94,29 triệu/m²"
2296,6/5/2021,Đường Kim Ngưu,Quận Hai Bà Trưng,Phường Thanh Nhàn,"Nhà ngõ, hẻm",Đã có sổ,4,6 phòng,47 m²,11.7 m,4 m,"59,57 triệu/m²"
2297,6/5/2021,"Đường Tôn Thất Tùng, Phường Hàng Bột, Quận Đống Đa, Hà Nội",Quận Đống Đa,Phường Hàng Bột,"Nhà ngõ, hẻm",Đã có sổ,4,4 phòng,68 m²,17 m,4 m,"117,65 triệu/m²"
2298,6/5/2021,"Đường Tây Sơn, Phường Trung Tự, Quận Đống Đa, Hà Nội",Quận Đống Đa,Phường Trung Tự,"Nhà ngõ, hẻm",Đã có sổ,4,3 phòng,30 m²,6 m,5 m,"133,33 triệu/m²"
2299,6/5/2021,"69, Đường Hoàng Văn Thái, Phường Khương Trung, Quận Thanh Xuân, Hà Nội",Quận Thanh Xuân,Phường Khương Trung,"Nhà ngõ, hẻm",Đã có sổ,4,5 phòng,45 m²,9 m,5 m,"74,44 triệu/m²"
2300,6/5/2021,"Đường Khâm Thiên, Phường Khâm Thiên, Quận Đống Đa, Hà Nội",Quận Đống Đa,Phường Khâm Thiên,"Nhà mặt phố, mặt tiền",Đã có sổ,5,4 phòng,35 m²,9 m,4 m,"94,29 triệu/m²"
2301,6/5/2021,"Đường Mậu Lương, Phường Phúc La, Quận Hà Đông, Hà Nội",Quận Hà Đông,Phường Phúc La,"Nhà mặt phố, mặt tiền",Đã có sổ,3,3 phòng,50 m²,5 m,5 m,48 triệu/m²
2302,6/5/2021,"Đường Hoàng Mai, Phường Tân Mai, Quận Hoàng Mai, Hà Nội",Quận Hoàng Mai,Phường Tân Mai,Nhà biệt thự,Đã có sổ,4,6 phòng,45 m²,7 m,10 m,"153,33 triệu/m²"
2303,6/5/2021,"Đường Hồ Giám, Phường Quốc Tử Giám, Quận Đống Đa, Hà Nội",Quận Đống Đa,Phường Quốc Tử Giám,"Nhà ngõ, hẻm",Đã có sổ,4,3 phòng,34 m²,8.5 m,4 m,"91,18 triệu/m²"
2304,6/5/2021,"Đường Mậu Lương, Phường Kiến Hưng, Quận Hà Đông, Hà Nội",Quận Hà Đông,Phường Kiến Hưng,"Nhà ngõ, hẻm",Đã có sổ,5,4 phòng,30 m²,8 m,4 m,70 triệu/m²
2305,6/5/2021,"Đường Trương Định, Phường Trương Định, Quận Hai Bà Trưng, Hà Nội",Quận Hai Bà Trưng,Phường Trương Định,"Nhà ngõ, hẻm",Đã có sổ,4,4 phòng,41 m²,9 m,5 m,"75,61 triệu/m²"
2306,6/5/2021,Đường Đê Trần Khát Chân,Quận Hai Bà Trưng,Phường Thanh Lương,"Nhà ngõ, hẻm",Đã có sổ,4,2 phòng,33 m²,3 m,8 m,"136,36 triệu/m²"
2307,6/5/2021,"Đường Nguyễn Viết Xuân, Phường La Khê, Quận Hà Đông, Hà Nội",Quận Hà Đông,Phường La Khê,"Nhà mặt phố, mặt tiền",Đã có sổ,4,4 phòng,45 m²,11 m,4 m,"88,89 triệu/m²"
2308,6/5/2021,"Đường Lê Duẩn, Phường Khâm Thiên, Quận Đống Đa, Hà Nội",Quận Đống Đa,Phường Khâm Thiên,"Nhà ngõ, hẻm",Đã có sổ,4,4 phòng,31 m²,10 m,3.1 m,"108,06 triệu/m²"
2309,6/5/2021,Đường Thái Thịnh,Quận Đống Đa,Phường Thịnh Quang,"Nhà ngõ, hẻm",Đã có sổ,5,6 phòng,42 m²,8.5 m,6.5 m,"96,43 triệu/m²"
2310,6/5/2021,"Đường Thái Hà, Phường Trung Liệt, Quận Đống Đa, Hà Nội",Quận Đống Đa,Phường Trung Liệt,"Nhà mặt phố, mặt tiền",Đã có sổ,5,5 phòng,78 m²,13 m,5 m,"169,23 triệu/m²"
2311,6/5/2021,"Đường Kim Giang||661, Phường Kim Giang, Quận Thanh Xuân, Hà Nội",Quận Thanh Xuân,Phường Kim Giang,"Nhà ngõ, hẻm",Đã có sổ,5,3 phòng,42 m²,8 m,3.8 m,"65,48 triệu/m²"
2312,6/5/2021,"Trần Thái Tông, Phường Dịch Vọng Hậu, Quận Cầu Giấy, Hà Nội",Quận Cầu Giấy,Phường Dịch Vọng Hậu,"Nhà ngõ, hẻm",Đã có sổ,5,6 phòng,58 m²,14 m,3.8 m,"62,07 triệu/m²"
2313,6/5/2021,"Đường Khương Trung, Phường Khương Trung, Quận Thanh Xuân, Hà Nội",Quận Thanh Xuân,Phường Khương Trung,"Nhà ngõ, hẻm",Đã có sổ,4,4 phòng,61 m²,19 m,3.2 m,"66,39 triệu/m²"
2314,6/5/2021,"Đường Trần Quốc Vượng, Phường Dịch Vọng, Quận Cầu Giấy, Hà Nội",Quận Cầu Giấy,Phường Dịch Vọng,"Nhà ngõ, hẻm",Đã có sổ,4,5 phòng,64 m²,17 m,4 m,"71,88 triệu/m²"
2315,6/5/2021,"Đường Nguyễn Khang, Phường Yên Hoà, Quận Cầu Giấy, Hà Nội",Quận Cầu Giấy,Phường Yên Hoà,"Nhà ngõ, hẻm",Đã có sổ,5,4 phòng,50 m²,8 m,6 m,100 triệu/m²
2316,6/5/2021,"Đường Vĩnh Phúc, Phường Vĩnh Phúc, Quận Ba Đình, Hà Nội",Quận Ba Đình,Phường Vĩnh Phúc,"Nhà ngõ, hẻm",Đã có sổ,4,3 phòng,30 m²,12.4 m,3.5 m,"66,67 triệu/m²"
2317,6/5/2021,"Đường Chùa Láng, Phường Láng Thượng, Quận Đống Đa, Hà Nội",Quận Đống Đa,Phường Láng Thượng,"Nhà ngõ, hẻm",Đã có sổ,5,5 phòng,45 m²,11 m,4 m,"86,67 triệu/m²"
2318,6/5/2021,"Thịnh Quang, Phường Thịnh Quang, Quận Đống Đa, Hà Nội",Quận Đống Đa,Phường Thịnh Quang,"Nhà ngõ, hẻm",Đã có sổ,4,4 phòng,38 m²,9.5 m,4 m,"86,84 triệu/m²"
2319,6/5/2021,"Đường Thái Hà, Phường Trung Liệt, Quận Đống Đa, Hà Nội",Quận Đống Đa,Phường Trung Liệt,"Nhà ngõ, hẻm",Đã có sổ,5,4 phòng,50 m²,10 m,5 m,185 triệu/m²
2320,6/5/2021,"Đường Ngọc Lâm, Phường Ngọc Lâm, Quận Long Biên, Hà Nội",Quận Long Biên,Phường Ngọc Lâm,"Nhà ngõ, hẻm",Đã có sổ,4,4 phòng,32 m²,9 m,3.5 m,"60,94 triệu/m²"
2321,6/5/2021,"Đường Khương Trung, Phường Khương Trung, Quận Thanh Xuân, Hà Nội",Quận Thanh Xuân,Phường Khương Trung,"Nhà ngõ, hẻm",Đã có sổ,3,3 phòng,31 m²,10 m,3.2 m,"64,52 triệu/m²"
2322,6/5/2021,"Kim Ngưu, Phường Thanh Lương, Quận Hai Bà Trưng, Hà Nội",Quận Hai Bà Trưng,Phường Thanh Lương,"Nhà ngõ, hẻm",Đã có sổ,5,3 phòng,33 m²,11 m,3.2 m,"109,09 triệu/m²"
2323,6/5/2021,"Đường Nguyễn Viết Xuân, Phường Quang Trung, Quận Hà Đông, Hà Nội",Quận Hà Đông,Phường Quang Trung,Nhà phố liền kề,Đã có sổ,4,4 phòng,48 m²,12 m,4 m,"83,33 triệu/m²"
2324,6/5/2021,"Đường Kim Giang, Phường Kim Giang, Quận Thanh Xuân, Hà Nội",Quận Thanh Xuân,Phường Kim Giang,"Nhà mặt phố, mặt tiền",Đã có sổ,5,4 phòng,41 m²,10 m,4 m,"70,73 triệu/m²"
2325,6/5/2021,"158, Đường Quan Nhân, Phường Nhân Chính, Quận Thanh Xuân, Hà Nội",Quận Thanh Xuân,Phường Nhân Chính,"Nhà ngõ, hẻm",Đã có sổ,7,3 phòng,30 m²,7.5 m,4 m,130 triệu/m²
2326,6/5/2021,"Đường Hoàng Hoa Thám, Phường Vĩnh Phúc, Quận Ba Đình, Hà Nội",Quận Ba Đình,Phường Vĩnh Phúc,"Nhà ngõ, hẻm",Đã có sổ,5,4 phòng,38 m²,4.5 m,4.5 m,"7,894736842 tỷ/m²"
2327,6/5/2021,"Đường Xuân Đỉnh, Phường Xuân Đỉnh, Quận Bắc Từ Liêm, Hà Nội",Quận Bắc Từ Liêm,Phường Xuân Đỉnh,"Nhà mặt phố, mặt tiền",Đã có sổ,4,4 phòng,68 m²,13.6 m,5 m,"63,97 triệu/m²"
2328,6/5/2021,"9, Đường Nguyễn Văn Linh, Phường Sài Đồng, Quận Long Biên, Hà Nội",Quận Long Biên,Phường Sài Đồng,"Nhà ngõ, hẻm",Đã có sổ,5,3 phòng,40 m²,10 m,3.8 m,80 triệu/m²
2330,6/5/2021,"Đường Ngọc Thụy, Phường Ngọc Thụy, Quận Long Biên, Hà Nội",Quận Long Biên,Phường Ngọc Thụy,"Nhà mặt phố, mặt tiền",Đã có sổ,5,3 phòng,37 m²,12.4 m,3 m,"83,78 triệu/m²"
2331,6/5/2021,"Đường Nguyễn Chí Thanh, Phường Ngọc Khánh, Quận Ba Đình, Hà Nội",Quận Ba Đình,Phường Ngọc Khánh,"Nhà mặt phố, mặt tiền",Đã có sổ,7,5 phòng,75 m²,12 m,6.2 m,"194,67 triệu/m²"
2332,6/5/2021,"99, Đường Hoàng Văn Thái, Phường Khương Trung, Quận Thanh Xuân, Hà Nội",Quận Thanh Xuân,Phường Khương Trung,"Nhà mặt phố, mặt tiền",Đã có sổ,3,4 phòng,70 m²,10 m,7 m,"95,71 triệu/m²"
2333,6/5/2021,"399, Đường Ngọc Lâm, Phường Ngọc Lâm, Quận Long Biên, Hà Nội",Quận Long Biên,Phường Ngọc Lâm,"Nhà mặt phố, mặt tiền",Đã có sổ,3,4 phòng,63 m²,18 m,35 m,"78,57 triệu/m²"
2334,6/5/2021,"Đường Mai Dịch||838, Phường Mai Dịch, Quận Cầu Giấy, Hà Nội",Quận Cầu Giấy,Phường Mai Dịch,Nhà biệt thự,Đã có sổ,6,6 phòng,170 m²,13 m,14 m,"264,71 triệu/m²"
2335,6/5/2021,"Đường Nguyễn Chí Thanh, Phường Láng Thượng, Quận Đống Đa, Hà Nội",Quận Đống Đa,Phường Láng Thượng,"Nhà ngõ, hẻm",Đã có sổ,5,4 phòng,37 m²,19 m,4 m,"164,86 triệu/m²"
2336,6/5/2021,"Đường Bát Khối, Phường Việt Hưng, Quận Long Biên, Hà Nội",Quận Long Biên,Phường Việt Hưng,"Nhà ngõ, hẻm",Đã có sổ,3,3 phòng,41 m²,40 m,6.5 m,"70,73 triệu/m²"
2337,6/5/2021,"Z133, Đường Lý Sơn, Phường Ngọc Thụy, Quận Long Biên, Hà Nội",Quận Long Biên,Phường Ngọc Thụy,"Nhà mặt phố, mặt tiền",Đã có sổ,3,3 phòng,57 m²,12 m,4 m,"78,95 triệu/m²"
2338,6/5/2021,"Đường Chùa Bộc, Phường Khương Thượng, Quận Đống Đa, Hà Nội",Quận Đống Đa,Phường Khương Thượng,"Nhà ngõ, hẻm",Đã có sổ,5,4 phòng,34 m²,6 m,5.4 m,"114,71 triệu/m²"
