3451,6/5/2021,"Đường Hoàng Mai, Phường Tân Mai, Quận Hoàng Mai, Hà Nội",Quận Hoàng Mai,Phường Tân Mai,"Nhà ngõ, hẻm",Đã có sổ,4,4 phòng,41 m²,12 m,3 m,"79,27 triệu/m²"
3452,6/5/2021,"Đường Âu Cơ, Phường Tứ Liên, Quận Tây Hồ, Hà Nội",Quận Tây Hồ,Phường Tứ Liên,"Nhà ngõ, hẻm",Đã có sổ,4,4 phòng,46 m²,11 m,4 m,"82,61 triệu/m²"
3454,6/5/2021,"Đường Nam Dư, Phường Lĩnh Nam, Quận Hoàng Mai, Hà Nội",Quận Hoàng Mai,Phường Lĩnh Nam,"Nhà ngõ, hẻm",Đã có sổ,5,3 phòng,32 m²,9 m,3 m,"79,69 triệu/m²"
3455,6/5/2021,"Đường Yên Nghĩa, Phường Yên Nghĩa, Quận Hà Đông, Hà Nội",Quận Hà Đông,Phường Yên Nghĩa,"Nhà mặt phố, mặt tiền",Đã có sổ,4,3 phòng,53 m²,10 m,5 m,"79,25 triệu/m²"
3456,6/5/2021,"Đường An Dương Vương, Phường Phú Thượng, Quận Tây Hồ, Hà Nội",Quận Tây Hồ,Phường Phú Thượng,"Nhà ngõ, hẻm",Đã có sổ,5,6 phòng,51 m²,12 m,4 m,"115,69 triệu/m²"
3457,6/5/2021,"Đường Hào Nam, Phường Trung Liệt, Quận Đống Đa, Hà Nội",Quận Đống Đa,Phường Trung Liệt,"Nhà mặt phố, mặt tiền",Đã có sổ,8,8 phòng,50 m²,10 m,5 m,278 triệu/m²
3458,6/5/2021,"126, Hào Nam, Phường Ô Chợ Dừa, Quận Đống Đa, Hà Nội",Quận Đống Đa,Phường Ô Chợ Dừa,"Nhà ngõ, hẻm",Đã có sổ,4,3 phòng,30 m²,8 m,4 m,"116,67 triệu/m²"
3459,6/5/2021,"Đường Ngọc Lâm, Phường Ngọc Lâm, Quận Long Biên, Hà Nội",Quận Long Biên,Phường Ngọc Lâm,"Nhà ngõ, hẻm",Đã có sổ,5,6 phòng,62 m²,17.2 m,3.6 m,"6,45 triệu/m²"
3460,6/5/2021,"Đường Nam Dư, Phường Lĩnh Nam, Quận Hoàng Mai, Hà Nội",Quận Hoàng Mai,Phường Lĩnh Nam,"Nhà mặt phố, mặt tiền",Đã có sổ,2,2 phòng,28 m²,9 m,3 m,"55,36 triệu/m²"
3461,6/5/2021,"Đường Tân Mai, Phường Tân Mai, Quận Hoàng Mai, Hà Nội",Quận Hoàng Mai,Phường Tân Mai,"Nhà ngõ, hẻm",Đã có sổ,4,2 phòng,25 m²,4 m,4 m,78 triệu/m²
3462,6/5/2021,"Đường Phạm Ngũ Lão, Phường Tràng Tiền, Quận Hoàn Kiếm, Hà Nội",Quận Hoàn Kiếm,Phường Tràng Tiền,"Nhà ngõ, hẻm",Đã có sổ,4,5 phòng,46 m²,4 m,4 m,"126,09 triệu/m²"
3463,6/5/2021,"Đường Đền Lừ, Phường Hoàng Văn Thụ, Quận Hoàng Mai, Hà Nội",Quận Hoàng Mai,Phường Hoàng Văn Thụ,"Nhà ngõ, hẻm",Đã có sổ,5,5 phòng,40 m²,10 m,4.1 m,"117,25 triệu/m²"
3465,6/5/2021,"Đường Định Công, Phường Định Công, Quận Hoàng Mai, Hà Nội",Quận Hoàng Mai,Phường Định Công,Nhà phố liền kề,Đã có sổ,4,4 phòng,67 m²,9 m,7 m,"89,55 triệu/m²"
3466,6/5/2021,"Đường Lý Thường Kiệt, Phường Quang Trung, Quận Hà Đông, Hà Nội",Quận Hà Đông,Phường Quang Trung,"Nhà mặt phố, mặt tiền",Đã có sổ,5,5 phòng,45 m²,11 m,4 m,"122,22 triệu/m²"
3467,6/5/2021,"Đường Hoàng Đạo Thành, Phường Kim Giang, Quận Thanh Xuân, Hà Nội",Quận Thanh Xuân,Phường Kim Giang,Nhà phố liền kề,Đã có sổ,3,5 phòng,149 m²,14 m,12 m,"117,45 triệu/m²"
3468,6/5/2021,"Đường Nam Dư, Phường Lĩnh Nam, Quận Hoàng Mai, Hà Nội",Quận Hoàng Mai,Phường Lĩnh Nam,"Nhà ngõ, hẻm",Đã có sổ,2,2 phòng,26 m²,8 m,3 m,"57,69 triệu/m²"
3469,6/5/2021,"Đường 19/5, Phường Phúc La, Quận Hà Đông, Hà Nội",Quận Hà Đông,Phường Phúc La,"Nhà ngõ, hẻm",Đã có sổ,4,3 phòng,20 m²,7 m,3 m,95 triệu/m²
3470,6/5/2021,"Đường Thái Hà, Phường Trung Liệt, Quận Đống Đa, Hà Nội",Quận Đống Đa,Phường Trung Liệt,"Nhà ngõ, hẻm",Đã có sổ,4,4 phòng,40 m²,10 m,4 m,140 triệu/m²
3471,6/5/2021,"82, Đường Cổ Nhuế, Phường Cổ Nhuế 2, Quận Bắc Từ Liêm, Hà Nội",Quận Bắc Từ Liêm,Phường Cổ Nhuế 2,"Nhà ngõ, hẻm",Đã có sổ,5,4 phòng,32 m²,11 m,3 m,"93,75 triệu/m²"
3472,6/5/2021,"Đường Nguyễn Chính, Phường Tân Mai, Quận Hoàng Mai, Hà Nội",Quận Hoàng Mai,Phường Tân Mai,"Nhà ngõ, hẻm",Đã có sổ,5,3 phòng,30 m²,10 m,3 m,"83,33 triệu/m²"
3473,6/5/2021,"Đường Định Công Hạ, Phường Định Công, Quận Hoàng Mai, Hà Nội",Quận Hoàng Mai,Phường Định Công,"Nhà ngõ, hẻm",Đã có sổ,5,4 phòng,40 m²,10 m,4 m,"87,5 triệu/m²"
3474,6/5/2021,"Đường Hà Trì 1, Phường Hà Cầu, Quận Hà Đông, Hà Nội",Quận Hà Đông,Phường Hà Cầu,"Nhà ngõ, hẻm",Đã có sổ,3,4 phòng,45 m²,4 m,10 m,"62,22 triệu/m²"
3475,6/5/2021,"360, Đường Xã Đàn, Phường Thổ Quan, Quận Đống Đa, Hà Nội",Quận Đống Đa,Phường Thổ Quan,"Nhà ngõ, hẻm",Đã có sổ,4,3 phòng,25 m²,5 m,5 m,10 triệu/m²
3476,6/5/2021,"Đường Linh Lang, Phường Cống Vị, Quận Ba Đình, Hà Nội",Quận Ba Đình,Phường Cống Vị,"Nhà mặt phố, mặt tiền",Đã có sổ,5,7 phòng,52 m²,10 m,5 m,"115,38 triệu/m²"
3477,6/5/2021,"Đường Định Công, Phường Định Công, Quận Hoàng Mai, Hà Nội",Quận Hoàng Mai,Phường Định Công,"Nhà ngõ, hẻm",Đã có sổ,5,3 phòng,32 m²,9 m,3 m,"81,88 triệu/m²"
3478,6/5/2021,"Đường Võ Chí Công, Phường Bưởi, Quận Tây Hồ, Hà Nội",Quận Tây Hồ,Phường Bưởi,"Nhà ngõ, hẻm",Đã có sổ,2,2 phòng,86 m²,92 m,9 m,"116,28 triệu/m²"
3479,6/5/2021,"204, Đường Cổ Linh, Phường Long Biên, Quận Long Biên, Hà Nội",Quận Long Biên,Phường Long Biên,"Nhà ngõ, hẻm",Đã có sổ,5,5 phòng,40 m²,41 m,4 m,"52,5 triệu/m²"
3480,6/5/2021,"Đường Định Công, Phường Định Công, Quận Hoàng Mai, Hà Nội",Quận Hoàng Mai,Phường Định Công,"Nhà ngõ, hẻm",Đã có sổ,4,4 phòng,66 m²,15 m,4.6 m,"68,18 triệu/m²"
3481,6/5/2021,"Đường Văn La, Phường Phú La, Quận Hà Đông, Hà Nội",Quận Hà Đông,Phường Phú La,"Nhà mặt phố, mặt tiền",Đã có sổ,2,2 phòng,22 m²,4 m,6 m,"63,64 triệu/m²"
3482,6/5/2021,"Đường Trương Định, Phường Trương Định, Quận Hai Bà Trưng, Hà Nội",Quận Hai Bà Trưng,Phường Trương Định,"Nhà ngõ, hẻm",Đã có sổ,5,6 phòng,55 m²,10 m,8 m,"67,27 triệu/m²"
3483,6/5/2021,"Ngọc Thuỵ, Phường Ngọc Thụy, Quận Long Biên, Hà Nội",Quận Long Biên,Phường Ngọc Thụy,"Nhà ngõ, hẻm",Đã có sổ,5,3 phòng,45 m²,10 m,450 m,56.666 đ/m²
3484,6/5/2021,"Đường Quang Trung||1869, Phường Quang Trung, Quận Hà Đông, Hà Nội",Quận Hà Đông,Phường Quang Trung,"Nhà ngõ, hẻm",Đã có sổ,2,2 phòng,40 m²,10 m,4 m,"65,5 triệu/m²"
3485,6/5/2021,"Đường Ngô Thì Nhậm, Phường Quang Trung, Quận Hà Đông, Hà Nội",Quận Hà Đông,Phường Quang Trung,"Nhà ngõ, hẻm",Đã có sổ,1,1 phòng,40 m²,10 m,4 m,"82,5 triệu/m²"
3486,6/5/2021,"118, Đường Mai Dịch, Phường Mai Dịch, Quận Cầu Giấy, Hà Nội",Quận Cầu Giấy,Phường Mai Dịch,"Nhà mặt phố, mặt tiền",Đã có sổ,5,4 phòng,50 m²,12 m,4 m,178 triệu/m²
3488,6/5/2021,"Đường Minh Khai, Phường Minh Khai, Quận Hai Bà Trưng, Hà Nội",Quận Hai Bà Trưng,Phường Minh Khai,"Nhà ngõ, hẻm",Đã có sổ,5,6 phòng,42 m²,11 m,3 m,"88,1 triệu/m²"
3489,6/5/2021,"Đường Triều Khúc, Phường Thanh Xuân Nam, Quận Thanh Xuân, Hà Nội",Quận Thanh Xuân,Phường Thanh Xuân Nam,"Nhà ngõ, hẻm",Đã có sổ,4,4 phòng,50 m²,13 m,4 m,74 triệu/m²
3490,6/5/2021,"Đường Hồ Tùng Mậu, Phường Mai Dịch, Quận Cầu Giấy, Hà Nội",Quận Cầu Giấy,Phường Mai Dịch,"Nhà ngõ, hẻm",Đã có sổ,8,nhiều hơn 10 phòng,95 m²,15 m,6 m,"122,11 triệu/m²"
3491,6/5/2021,"Đường Văn Quán, Phường Văn Quán, Quận Hà Đông, Hà Nội",Quận Hà Đông,Phường Văn Quán,"Nhà mặt phố, mặt tiền",Đã có sổ,5,5 phòng,35 m²,10 m,3 m,"122,86 triệu/m²"
3492,6/5/2021,"Quốc Tử Giám, Phường Văn Miếu, Quận Đống Đa, Hà Nội",Quận Đống Đa,Phường Văn Miếu,"Nhà mặt phố, mặt tiền",Đã có sổ,5,4 phòng,30 m²,1 m,1 m,"88,33 triệu/m²"
3493,6/5/2021,"Đường Nguyên Hồng, Phường Láng Hạ, Quận Đống Đa, Hà Nội",Quận Đống Đa,Phường Láng Hạ,"Nhà mặt phố, mặt tiền",Đã có sổ,1,1 phòng,42 m²,8 m,5.2 m,"52,38 triệu/m²"
3494,6/5/2021,"Đường Khu tập thể Thành Công, Phường Thành Công, Quận Ba Đình, Hà Nội",Quận Ba Đình,Phường Thành Công,"Nhà ngõ, hẻm",Đã có sổ,4,2 phòng,30 m²,10 m,4 m,85 triệu/m²
3495,6/5/2021,"Đường Láng Hạ, Phường Láng Hạ, Quận Đống Đa, Hà Nội",Quận Đống Đa,Phường Láng Hạ,"Nhà ngõ, hẻm",Đã có sổ,6,4 phòng,35 m²,10 m,3.3 m,"94,29 triệu/m²"
3496,6/5/2021,"Đường Đội Cấn, Phường Cống Vị, Quận Ba Đình, Hà Nội",Quận Ba Đình,Phường Cống Vị,"Nhà ngõ, hẻm",Đã có sổ,4,3 phòng,55 m²,8 m,4 m,"136,36 triệu/m²"
3497,6/5/2021,"KĐT Văn Quán, Phường Văn Quán, Quận Hà Đông, Hà Nội",Quận Hà Đông,Phường Văn Quán,"Nhà ngõ, hẻm",Đã có sổ,5,4 phòng,39 m²,10 m,4 m,"93,59 triệu/m²"
3498,6/5/2021,"Đường Yên Lãng, Phường Láng Hạ, Quận Đống Đa, Hà Nội",Quận Đống Đa,Phường Láng Hạ,"Nhà ngõ, hẻm",Đã có sổ,6,4 phòng,35 m²,10 m,3.3 m,"94,29 triệu/m²"
3499,6/5/2021,"Đường Vũ Ngọc Phan, Phường Láng Hạ, Quận Đống Đa, Hà Nội",Quận Đống Đa,Phường Láng Hạ,"Nhà ngõ, hẻm",Đã có sổ,6,6 phòng,45 m²,10.1 m,4.2 m,140 triệu/m²
3500,6/5/2021,"Đường Hoàng Quốc Việt, Phường Nghĩa Đô, Quận Cầu Giấy, Hà Nội",Quận Cầu Giấy,Phường Nghĩa Đô,"Nhà mặt phố, mặt tiền",Đang chờ sổ,2,2 phòng,52 m²,15 m,3 m,"72,12 triệu/m²"
3501,6/5/2021,"Đường Đại Từ, Phường Thịnh Liệt, Quận Hoàng Mai, Hà Nội",Quận Hoàng Mai,Phường Thịnh Liệt,"Nhà mặt phố, mặt tiền",Đã có sổ,6,6 phòng,64 m²,8 m,8 m,"170,31 triệu/m²"
3502,6/5/2021,"Đường Phạm Ngũ Lão, Phường Tràng Tiền, Quận Hoàn Kiếm, Hà Nội",Quận Hoàn Kiếm,Phường Tràng Tiền,"Nhà ngõ, hẻm",Đã có sổ,4,5 phòng,45 m²,13 m,3 m,"128,89 triệu/m²"
3503,6/5/2021,"150, Đường Giáp Nhị, Phường Thịnh Liệt, Quận Hoàng Mai, Hà Nội",Quận Hoàng Mai,Phường Thịnh Liệt,"Nhà mặt phố, mặt tiền",Đã có sổ,5,4 phòng,43 m²,14 m,3 m,"94,19 triệu/m²"
3504,6/5/2021,"Đường Vũ Ngọc Phan, Phường Láng Hạ, Quận Đống Đa, Hà Nội",Quận Đống Đa,Phường Láng Hạ,"Nhà ngõ, hẻm",Đã có sổ,5,5 phòng,62 m²,4 m,4 m,"91,94 triệu/m²"
3505,6/5/2021,"PHỐ ĐỊNH CÔNG THƯỢNG, Phường Định Công, Quận Hoàng Mai, Hà Nội",Quận Hoàng Mai,Phường Định Công,"Nhà ngõ, hẻm",Đã có sổ,5,4 phòng,46 m²,10 m,4 m,"70,65 triệu/m²"
3506,6/5/2021,"Đường Lê Trọng Tấn, Phường Khương Mai, Quận Thanh Xuân, Hà Nội",Quận Thanh Xuân,Phường Khương Mai,"Nhà ngõ, hẻm",Đã có sổ,6,4 phòng,45 m²,9 m,5 m,"124,44 triệu/m²"
3507,6/5/2021,"Đường Huy Văn, Phường Hàng Bột, Quận Đống Đa, Hà Nội",Quận Đống Đa,Phường Hàng Bột,"Nhà ngõ, hẻm",Đã có sổ,3,3 phòng,37 m²,7 m,5 m,"89,19 triệu/m²"
3508,6/5/2021,"Đường Tam Trinh, Phường Yên Sở, Quận Hoàng Mai, Hà Nội",Quận Hoàng Mai,Phường Yên Sở,"Nhà ngõ, hẻm",Đã có sổ,5,3 phòng,33 m²,6 m,5 m,"75,76 triệu/m²"
3509,6/5/2021,"Đường Phan Bội Châu, Phường Cửa Nam, Quận Hoàn Kiếm, Hà Nội",Quận Hoàn Kiếm,Phường Cửa Nam,"Nhà ngõ, hẻm",Đã có sổ,4,3 phòng,20 m²,5 m,4 m,220 triệu/m²
3510,6/5/2021,"Đường Thổ Quan, Phường Thổ Quan, Quận Đống Đa, Hà Nội",Quận Đống Đa,Phường Thổ Quan,"Nhà ngõ, hẻm",Đã có sổ,4,3 phòng,46 m²,11 m,4 m,"97,83 triệu/m²"
3511,6/5/2021,"Đường Ngõ Gốc Đề, Phường Hoàng Văn Thụ, Quận Hoàng Mai, Hà Nội",Quận Hoàng Mai,Phường Hoàng Văn Thụ,"Nhà ngõ, hẻm",Đã có sổ,5,3 phòng,36 m²,9 m,4 m,"79,17 triệu/m²"
3512,6/5/2021,"Đường Phạm Ngọc Thạch, Phường Trung Tự, Quận Đống Đa, Hà Nội",Quận Đống Đa,Phường Trung Tự,"Nhà ngõ, hẻm",Đã có sổ,4,3 phòng,50 m²,9 m,6 m,94 triệu/m²
3513,6/5/2021,"Đường Trần Hữu Dực, Phường Xuân Phương, Quận Nam Từ Liêm, Hà Nội",Quận Nam Từ Liêm,Phường Xuân Phương,"Nhà ngõ, hẻm",Đã có sổ,5,4 phòng,35 m²,12 m,3 m,"75,71 triệu/m²"
3514,6/5/2021,"Đường Đê La Thành, Phường Cống Vị, Quận Ba Đình, Hà Nội",Quận Ba Đình,Phường Cống Vị,"Nhà ngõ, hẻm",Đã có sổ,1,1 phòng,40 m²,13 m,3.5 m,"83,75 triệu/m²"
3516,6/5/2021,"Đường Huỳnh Thúc Kháng, Phường Láng Thượng, Quận Đống Đa, Hà Nội",Quận Đống Đa,Phường Láng Thượng,"Nhà ngõ, hẻm",Đã có sổ,5,4 phòng,44 m²,11 m,4 m,"161,36 triệu/m²"
3517,6/5/2021,"Đường Lạc Long Quân, Phường Xuân La, Quận Tây Hồ, Hà Nội",Quận Tây Hồ,Phường Xuân La,"Nhà ngõ, hẻm",Đã có sổ,4,5 phòng,55 m²,11 m,5 m,"88,18 triệu/m²"
3518,6/5/2021,"Đường Nhân Huệ, Phường Đồng Mai, Quận Hà Đông, Hà Nội",Quận Hà Đông,Phường Đồng Mai,"Nhà ngõ, hẻm",Đã có sổ,4,3 phòng,35 m²,10 m,3.5 m,"39,43 triệu/m²"
3519,6/5/2021,"Đường Lạc Long Quân, Phường Bưởi, Quận Tây Hồ, Hà Nội",Quận Tây Hồ,Phường Bưởi,"Nhà mặt phố, mặt tiền",Đã có sổ,7,7 phòng,60 m²,12 m,5 m,"216,67 triệu/m²"
3520,6/5/2021,"Đường Hồng Mai, Phường Quỳnh Lôi, Quận Hai Bà Trưng, Hà Nội",Quận Hai Bà Trưng,Phường Quỳnh Lôi,"Nhà ngõ, hẻm",Đã có sổ,4,4 phòng,45 m²,15 m,4 m,"97,78 triệu/m²"
3521,6/5/2021,"Đường Lê Trọng Tấn, Phường Dương Nội, Quận Hà Đông, Hà Nội",Quận Hà Đông,Phường Dương Nội,"Nhà ngõ, hẻm",Đã có sổ,4,3 phòng,30 m²,9 m,35 m,60 triệu/m²
3522,6/5/2021,"Đường Âu Cơ, Phường Tứ Liên, Quận Tây Hồ, Hà Nội",Quận Tây Hồ,Phường Tứ Liên,"Nhà ngõ, hẻm",Đã có sổ,4,4 phòng,44 m²,8.8 m,5 m,"80,68 triệu/m²"
3523,6/5/2021,"Đường Quang Tiến, Phường Đại Mỗ, Quận Nam Từ Liêm, Hà Nội",Quận Nam Từ Liêm,Phường Đại Mỗ,"Nhà ngõ, hẻm",Đã có sổ,4,4 phòng,45 m²,12.8 m,3.5 m,"62,22 triệu/m²"
3524,6/5/2021,"Đường Hòa Bình, Phường Yên Nghĩa, Quận Hà Đông, Hà Nội",Quận Hà Đông,Phường Yên Nghĩa,"Nhà ngõ, hẻm",Đã có sổ,4,3 phòng,40 m²,10 m,4 m,"41,25 triệu/m²"
3525,6/5/2021,"Đường Quốc lộ 6, Phường Yên Nghĩa, Quận Hà Đông, Hà Nội",Quận Hà Đông,Phường Yên Nghĩa,"Nhà ngõ, hẻm",Đã có sổ,4,4 phòng,36 m²,7 m,5 m,"46,67 triệu/m²"
3526,6/5/2021,"Đường Kiến Hưng, Phường Kiến Hưng, Quận Hà Đông, Hà Nội",Quận Hà Đông,Phường Kiến Hưng,"Nhà ngõ, hẻm",Đã có sổ,3,3 phòng,46 m²,15 m,3 m,"43,04 triệu/m²"
3527,6/5/2021,"Đường Tô Hiệu, Phường Hà Cầu, Quận Hà Đông, Hà Nội",Quận Hà Đông,Phường Hà Cầu,"Nhà ngõ, hẻm",Đã có sổ,5,4 phòng,35 m²,9 m,4 m,"71,43 triệu/m²"
3528,6/5/2021,"Đường Phúc Tân, Phường Chương Dương, Quận Hoàn Kiếm, Hà Nội",Quận Hoàn Kiếm,Phường Chương Dương,"Nhà ngõ, hẻm",Đã có sổ,4,3 phòng,48 m²,10 m,5 m,"68,75 triệu/m²"
3529,6/5/2021,"36, QL6, Phường Yên Nghĩa, Quận Hà Đông, Hà Nội",Quận Hà Đông,Phường Yên Nghĩa,"Nhà ngõ, hẻm",Đã có sổ,3,3 phòng,35 m²,9 m,4 m,46 triệu/m²
3530,6/5/2021,"Đường Tân Triều, Phường Thanh Xuân Bắc, Quận Thanh Xuân, Hà Nội",Quận Thanh Xuân,Phường Thanh Xuân Bắc,"Nhà ngõ, hẻm",Đã có sổ,4,3 phòng,30 m²,6 m,5 m,"96,67 triệu/m²"
3531,6/5/2021,"105, Đường Xuân La, Phường Xuân La, Quận Tây Hồ, Hà Nội",Quận Tây Hồ,Phường Xuân La,"Nhà ngõ, hẻm",Đã có sổ,4,4 phòng,60 m²,15 m,4 m,135 triệu/m²
3532,6/5/2021,"Đường Thông Phong, Phường Quốc Tử Giám, Quận Đống Đa, Hà Nội",Quận Đống Đa,Phường Quốc Tử Giám,"Nhà ngõ, hẻm",Đã có sổ,5,3 phòng,15 m²,5 m,3 m,"90,67 triệu/m²"
3533,6/5/2021,"Đường Trần Cung, Phường Cổ Nhuế 1, Quận Bắc Từ Liêm, Hà Nội",Quận Bắc Từ Liêm,Phường Cổ Nhuế 1,"Nhà ngõ, hẻm",Đã có sổ,5,4 phòng,40 m²,10 m,4 m,"107,5 triệu/m²"
3534,6/5/2021,"Đường Nguyễn Khang, Phường Yên Hoà, Quận Cầu Giấy, Hà Nội",Quận Cầu Giấy,Phường Yên Hoà,"Nhà ngõ, hẻm",Đã có sổ,5,3 phòng,30 m²,10 m,3 m,"88,33 triệu/m²"
3535,6/5/2021,"Đường Bạch Mai, Phường Bạch Mai, Quận Hai Bà Trưng, Hà Nội",Quận Hai Bà Trưng,Phường Bạch Mai,"Nhà ngõ, hẻm",Đã có sổ,2,3 phòng,29 m²,9.5 m,3 m,"58,62 triệu/m²"
3536,6/5/2021,"Đường Quốc lộ 6, Phường Yên Nghĩa, Quận Hà Đông, Hà Nội",Quận Hà Đông,Phường Yên Nghĩa,"Nhà ngõ, hẻm",Đã có sổ,4,3 phòng,41 m²,10 m,4.2 m,"41,46 triệu/m²"
3537,6/5/2021,"Đường Tân Xuân, Phường Xuân Đỉnh, Quận Bắc Từ Liêm, Hà Nội",Quận Bắc Từ Liêm,Phường Xuân Đỉnh,"Nhà ngõ, hẻm",Đã có sổ,3,3 phòng,50 m²,10 m,4 m,50 triệu/m²
3538,6/5/2021,"Thanh Nhàn, Phường Thanh Nhàn, Quận Hai Bà Trưng, Hà Nội",Quận Hai Bà Trưng,Phường Thanh Nhàn,"Nhà ngõ, hẻm",Đã có sổ,3,2 phòng,17 m²,5 m,3.5 m,"94,12 triệu/m²"
3539,6/5/2021,"Đường Hoàng Hoa Thám, Phường Vĩnh Phúc, Quận Ba Đình, Hà Nội",Quận Ba Đình,Phường Vĩnh Phúc,"Nhà ngõ, hẻm",Đã có sổ,5,6 phòng,48 m²,10 m,5 m,"98,96 triệu/m²"
3540,6/5/2021,"Đường Mậu Lương, Phường Kiến Hưng, Quận Hà Đông, Hà Nội",Quận Hà Đông,Phường Kiến Hưng,"Nhà ngõ, hẻm",Đã có sổ,4,4 phòng,38 m²,10 m,3 m,"61,84 triệu/m²"
3541,6/5/2021,"11/34 ngõ 252 tay son, Đường Tây Sơn, Phường Trung Liệt, Quận Đống Đa, Hà Nội",Quận Đống Đa,Phường Trung Liệt,Nhà phố liền kề,Đã có sổ,4,3 phòng,35 m²,6 m,6 m,"97,14 triệu/m²"
3542,6/5/2021,"N, Đường Vĩnh Phúc, Phường Vĩnh Phúc, Quận Ba Đình, Hà Nội",Quận Ba Đình,Phường Vĩnh Phúc,"Nhà mặt phố, mặt tiền",Đã có sổ,5,5 phòng,46 m²,12.5 m,3.7 m,"210,87 triệu/m²"
3543,6/5/2021,"Đường Thái Thịnh, Phường Thịnh Quang, Quận Đống Đa, Hà Nội",Quận Đống Đa,Phường Thịnh Quang,"Nhà ngõ, hẻm",Đã có sổ,3,3 phòng,25 m²,8 m,3 m,76 triệu/m²
3544,6/5/2021,"Đường Nghi Tàm, Phường Yên Phụ, Quận Tây Hồ, Hà Nội",Quận Tây Hồ,Phường Yên Phụ,"Nhà ngõ, hẻm",Đã có sổ,4,4 phòng,46 m²,10 m,4 m,"86,96 triệu/m²"
3545,6/5/2021,"8, Đường Tây Sơn, Phường Trung Liệt, Quận Đống Đa, Hà Nội",Quận Đống Đa,Phường Trung Liệt,"Nhà ngõ, hẻm",Đã có sổ,5,3 phòng,31 m²,7 m,4 m,"124,19 triệu/m²"
3546,6/5/2021,"Ngõ 75, Đường Phú Diễn, Phường Phú Diễn, Quận Bắc Từ Liêm, Hà Nội",Quận Bắc Từ Liêm,Phường Phú Diễn,Nhà phố liền kề,Đã có sổ,5,5 phòng,40 m²,8 m,5 m,"116,25 triệu/m²"
3547,6/5/2021,"Ngõ chợ Khâm Thiên, Phường Khâm Thiên, Quận Đống Đa, Hà Nội",Quận Đống Đa,Phường Khâm Thiên,"Nhà ngõ, hẻm",Đã có sổ,3,3 phòng,20 m²,5 m,4 m,94 triệu/m²
3548,6/5/2021,"Đường Bằng Liệt, Phường Hoàng Liệt, Quận Hoàng Mai, Hà Nội",Quận Hoàng Mai,Phường Hoàng Liệt,"Nhà mặt phố, mặt tiền",Đã có sổ,3,5 phòng,71 m²,16 m,4 m,"67,61 triệu/m²"
3549,6/5/2021,"Đường Nguyễn Khánh Toàn, Phường Dịch Vọng, Quận Cầu Giấy, Hà Nội",Quận Cầu Giấy,Phường Dịch Vọng,"Nhà ngõ, hẻm",Đã có sổ,5,4 phòng,50 m²,11 m,4 m,122 triệu/m²
3550,6/5/2021,"Đường Khương Thượng, Phường Khương Thượng, Quận Đống Đa, Hà Nội",Quận Đống Đa,Phường Khương Thượng,"Nhà mặt phố, mặt tiền",Đã có sổ,5,4 phòng,30 m²,8 m,4 m,130 triệu/m²
3551,6/5/2021,"Đường Ngọc Thụy, Phường Ngọc Thụy, Quận Long Biên, Hà Nội",Quận Long Biên,Phường Ngọc Thụy,"Nhà ngõ, hẻm",Đã có sổ,5,6 phòng,80 m²,20 m,4 m,"3,75 triệu/m²"
3552,6/5/2021,"67, KĐT Việt Hưng, Phường Việt Hưng, Quận Long Biên, Hà Nội",Quận Long Biên,Phường Việt Hưng,"Nhà ngõ, hẻm",Đã có sổ,5,3 phòng,36 m²,10 m,4 m,"73,61 triệu/m²"
3553,6/5/2021,"321, Đường Phùng Khoang, Phường Trung Văn, Quận Nam Từ Liêm, Hà Nội",Quận Nam Từ Liêm,Phường Trung Văn,"Nhà ngõ, hẻm",Đã có sổ,4,4 phòng,49 m²,12 m,4 m,"92,82 triệu/m²"
3554,6/5/2021,"9, Đường Cầu Giấy, Phường Mai Dịch, Quận Cầu Giấy, Hà Nội",Quận Cầu Giấy,Phường Mai Dịch,"Nhà mặt phố, mặt tiền",Đã có sổ,3,3 phòng,40 m²,15 m,3 m,100 triệu/m²
3555,6/5/2021,"Đường Trần Phú, Phường Quang Trung, Quận Hà Đông, Hà Nội",Quận Hà Đông,Phường Quang Trung,"Nhà mặt phố, mặt tiền",Đã có sổ,4,3 phòng,39 m²,10 m,3 m,"103,85 triệu/m²"
3556,6/5/2021,"Đường Bùi Xương Trạch, Phường Khương Đình, Quận Thanh Xuân, Hà Nội",Quận Thanh Xuân,Phường Khương Đình,"Nhà ngõ, hẻm",Đã có sổ,4,2 phòng,35 m²,7 m,5 m,"74,29 triệu/m²"
3557,6/5/2021,"Đường Điện Biên Phủ, Phường Điện Biên, Quận Ba Đình, Hà Nội",Quận Ba Đình,Phường Điện Biên,"Nhà mặt phố, mặt tiền",Đã có sổ,8,10 phòng,60 m²,8 m,8 m,"533,33 triệu/m²"
3558,6/5/2021,"Đường Gia Quất, Phường Thượng Thanh, Quận Long Biên, Hà Nội",Quận Long Biên,Phường Thượng Thanh,"Nhà ngõ, hẻm",Đã có sổ,4,3 phòng,24 m²,6 m,3 m,"72,92 triệu/m²"
3559,6/5/2021,"Đường Phạm Tuấn Tài, Phường Nghĩa Tân, Quận Cầu Giấy, Hà Nội",Quận Cầu Giấy,Phường Nghĩa Tân,"Nhà ngõ, hẻm",Đã có sổ,4,6 phòng,41 m²,9 m,4 m,"190,24 triệu/m²"
3560,6/5/2021,"Đường Kim Giang, Phường Kim Giang, Quận Thanh Xuân, Hà Nội",Quận Thanh Xuân,Phường Kim Giang,"Nhà ngõ, hẻm",Đã có sổ,4,5 phòng,35 m²,9 m,8 m,"77,14 triệu/m²"
3561,6/5/2021,"Đường Triều Khúc, Phường Thanh Xuân Nam, Quận Thanh Xuân, Hà Nội",Quận Thanh Xuân,Phường Thanh Xuân Nam,"Nhà ngõ, hẻm",Đã có sổ,4,3 phòng,25 m²,8 m,3 m,72 triệu/m²
3562,6/5/2021,"Đường Phúc Lợi, Phường Long Biên, Quận Long Biên, Hà Nội",Quận Long Biên,Phường Long Biên,"Nhà ngõ, hẻm",Đã có sổ,3,3 phòng,36 m²,12 m,3 m,"58,33 triệu/m²"
3563,6/5/2021,"6A ngõ 121/3/10, Đường Kim Ngưu, Phường Thanh Lương, Quận Hai Bà Trưng, Hà Nội",Quận Hai Bà Trưng,Phường Thanh Lương,"Nhà ngõ, hẻm",Đã có sổ,4,4 phòng,50 m²,11 m,5 m,74 triệu/m²
3564,6/5/2021,"Đường Bằng Liệt, Phường Hoàng Liệt, Quận Hoàng Mai, Hà Nội",Quận Hoàng Mai,Phường Hoàng Liệt,"Nhà ngõ, hẻm",Đã có sổ,4,5 phòng,71 m²,14 m,5 m,"67,61 triệu/m²"
3565,6/5/2021,"Đường Văn La, Phường Phú La, Quận Hà Đông, Hà Nội",Quận Hà Đông,Phường Phú La,"Nhà mặt phố, mặt tiền",Đã có sổ,4,3 phòng,40 m²,12 m,3 m,"96,25 triệu/m²"
3566,6/5/2021,"Đường Nguyễn Công Trứ, Phường Văn Quán, Quận Hà Đông, Hà Nội",Quận Hà Đông,Phường Văn Quán,"Nhà mặt phố, mặt tiền",Đã có sổ,4,3 phòng,47 m²,12 m,4 m,"134,04 triệu/m²"
3567,6/5/2021,"Đường Quang Trung, Phường La Khê, Quận Hà Đông, Hà Nội",Quận Hà Đông,Phường La Khê,"Nhà ngõ, hẻm",Đã có sổ,5,5 phòng,37 m²,11 m,3 m,"78,38 triệu/m²"
3568,6/5/2021,"8, Đường Lê Hồng Phong, Phường Quang Trung, Quận Hà Đông, Hà Nội",Quận Hà Đông,Phường Quang Trung,"Nhà ngõ, hẻm",Đã có sổ,1,1 phòng,40 m²,7 m,6 m,"44,75 triệu/m²"
3569,6/5/2021,"106, Đường Doãn Kế Thiện, Phường Mai Dịch, Quận Cầu Giấy, Hà Nội",Quận Cầu Giấy,Phường Mai Dịch,"Nhà ngõ, hẻm",Đã có sổ,5,6 phòng,62 m²,16 m,4 m,"112,9 triệu/m²"
3570,6/5/2021,"Đường Mỹ Đình 1, Phường Mỹ Đình 1, Quận Nam Từ Liêm, Hà Nội",Quận Nam Từ Liêm,Phường Mỹ Đình 1,"Nhà ngõ, hẻm",Đã có sổ,6,nhiều hơn 10 phòng,64 m²,16 m,4 m,"113,28 triệu/m²"
3571,6/5/2021,"Đường Kim Đồng, Phường Giáp Bát, Quận Hoàng Mai, Hà Nội",Quận Hoàng Mai,Phường Giáp Bát,"Nhà ngõ, hẻm",Đã có sổ,4,4 phòng,33 m²,9 m,7 m,"84,85 triệu/m²"
3572,6/5/2021,"Đường Dương Văn Bé, Phường Vĩnh Tuy, Quận Hai Bà Trưng, Hà Nội",Quận Hai Bà Trưng,Phường Vĩnh Tuy,"Nhà mặt phố, mặt tiền",Đã có sổ,4,3 phòng,30 m²,10 m,3 m,"216,67 triệu/m²"
